{
  "schemaVersion": 1,
  "id": "11111111-1111-4111-8111-111111111111",
  "route": "/about/",
  "title": "About — synthetic proof",
  "templateVersion": "sane-default@1",
  "nodes": [
    {
      "id": "22222222-2222-4222-8222-222222222222",
      "type": "sane.hero",
      "componentVersion": 1,
      "variant": "minimal",
      "props": {
        "headline": "About our space",
        "intro": "Synthetic proof content; not a live page."
      },
      "layout": {
        "width": "content",
        "spacing": "large",
        "align": "center",
        "mobile": {
          "spacing": "medium"
        }
      }
    },
    {
      "id": "33333333-3333-4333-8333-333333333333",
      "type": "sane.aboutSections",
      "componentVersion": 1,
      "variant": "alternating",
      "props": {},
      "bindings": {
        "sections": {
          "resource": "about",
          "key": "sections"
        }
      },
      "layout": {
        "width": "wide",
        "spacing": "medium"
      }
    }
  ]
}
